{
  "timestamp": "2026-08-26T00:00:01.1Z",
  "component": "example_component",
  "event": "example.process.failed",
  "level": "fatal",
  "message": "",
  "trace_id": "aaaaaaaaaaaaaaaaaaaaaaaaaaaaaaaa",
  "span_id": "bbbbbbbbbbbbbbbb",
  "attributes": {
    "empty_string": "",
    "empty_array": [],
    "empty_object": {}
  }
}
