{
  "timestamp": "2026-08-26T00:00:02.123456789Z",
  "component": "example_component",
  "event": "document.read.failed",
  "level": "error",
  "message": "document read failed",
  "trace_id": "4bf92f3577b34da6a3ce929d0e0e4736",
  "span_id": "00f067aa0ba902b7",
  "attributes": {
    "error_type": "document.file_not_found",
    "document_id": "doc-123",
    "attempt": 2,
    "large_integer": 9007199254740993,
    "precise_decimal": 0.12345678901234567890123456789,
    "cache_hit": false,
    "items": [
      "a",
      2,
      false,
      [],
      {}
    ],
    "detail": {
      "labels": [
        "x",
        "y"
      ],
      "nested": {
        "enabled": true
      }
    }
  }
}
